{
  "schema": "humanaios/system_stance_v1",
  "advisory_only": true,
  "can_authorize": false,
  "authority_effect": "NONE",
  "subject": {
    "repository": "humanaios-ui/operations",
    "ref": "64c26cb058cf20eb5145c5ccfb9d4cc9c929871f",
    "scope": "Potential evidence-integrity improvements"
  },
  "overall_stance": "ACQUIRE_EVIDENCE",
  "stance_rationale": "The opportunity is plausible, but unresolved eligibility and authority checks remain.",
  "certainty": {
    "level": "MODERATE",
    "basis": "One repository specification and a matching implementation were inspected.",
    "limitations": ["External adoption has not been measured."]
  },
  "opportunity_scan": {
    "status": "PARTIAL",
    "scope": "Repository evidence only",
    "limitations": ["External dependencies were not contacted."],
    "opportunities": [
      {
        "id": "OP-1",
        "description": "Improve evidence provenance before consequential decisions.",
        "propositions": [
          {
            "claim": "The proposed check can detect missing source references.",
            "evidence": [
              {
                "relation": "SUPPORTS",
                "kind": "source",
                "locator": "schemas/intent_os_operator_check_v1.schema.json:108",
                "observation": "The schema requires each evidence locator to include a specificity marker."
              },
              {
                "relation": "CONTRADICTS",
                "kind": "source",
                "locator": "docs/INTENT_OS_RNOLA_INTEGRATION.md#limitations",
                "observation": "The integration remains advisory and does not establish source truth."
              }
            ],
            "certainty": {
              "level": "MODERATE",
              "basis": "The schema requirement is explicit, but no external-source validation is performed.",
              "limitations": ["The schema cannot verify that cited evidence is accurate."]
            }
          }
        ]
      }
    ]
  },
  "pre_action_requirements": [
    {
      "check": "Confirm that the evidence is current and applicable.",
      "status": "OPEN",
      "verification": "Re-read the cited source at the exact version relevant to the proposed action.",
      "evidence": []
    },
    {
      "check": "Confirm the required authority for any consequential action.",
      "status": "VERIFIED",
      "verification": "Inspect the current governance authority boundary.",
      "evidence": [
        {
          "relation": "SUPPORTS",
          "kind": "source",
          "locator": "GOVERNANCE.md:14",
          "observation": "The governance document assigns ratification and execution to their defined roles."
        }
      ]
    }
  ],
  "not_established": ["That acting on this opportunity will produce the intended outcome."],
  "created_at": "2026-10-03T16:00:00Z"
}
